{
  "version": "0.1.4",
  "mode": "audit-only",
  "parserPolicy": {
    "inspectEverySegment": true,
    "inspectScriptBodies": true,
    "rejectUnknownExecutables": true,
    "rejectShellWrappers": true,
    "rejectHeredocs": true,
    "rejectRedirection": true,
    "providerSpecificNpx": true,
    "authenticatedCurlRequiresApproval": true,
    "boundedReadsRequired": true,
    "allowedComposition": "read-only"
  },
  "allowedFamilies": [
    {
      "name": "runtime-status",
      "executables": ["ps", "ss", "systemctl", "pm2", "docker"],
      "argumentPolicy": {
        "strategy": "status-only",
        "allowedPatterns": ["bounded process, listener, service, manager, and container status"],
        "deniedPatterns": ["start, stop, restart, reload, enable, disable, signals, and unbounded logs"]
      },
      "constraints": [
        "Use status and inspection forms only.",
        "Filter output to the named process, service, container, or port."
      ]
    },
    {
      "name": "safe-health-check",
      "executables": ["curl"],
      "argumentPolicy": {
        "strategy": "pattern",
        "allowedPatterns": ["unauthenticated HTTP GET to localhost health paths"],
        "deniedPatterns": ["authorization, credentials, request bodies, uploads, and non-health endpoints"]
      },
      "constraints": [
        "Use only unauthenticated local or explicitly approved public health endpoints.",
        "Do not send credentials, cookies, or mutation methods."
      ]
    }
  ],
  "restrictedCategories": [
    "file-write",
    "package-install",
    "deployment",
    "git-mutation",
    "unrestricted-scan",
    "secret-read",
    "process-mutation",
    "service-mutation",
    "migration-apply",
    "privileged-api"
  ],
  "approvalExceptions": [
    "A named public health endpoint or bounded non-secret log may be approved."
  ]
}
