{
  "version": "0.1.3",
  "mode": "audit-only",
  "parserPolicy": {
    "inspectEverySegment": true,
    "inspectScriptBodies": true,
    "rejectUnknownExecutables": true,
    "rejectShellWrappers": true,
    "rejectHeredocs": true,
    "rejectRedirection": true,
    "providerSpecificNpx": true,
    "authenticatedCurlRequiresApproval": true,
    "boundedReadsRequired": true,
    "allowedComposition": "read-only"
  },
  "allowedFamilies": [
    {
      "name": "bounded-file-inspection",
      "executables": ["pwd", "ls", "rg", "find", "sed", "head"],
      "argumentPolicy": {
        "strategy": "pattern",
        "allowedPatterns": ["bounded repository-local inspection"],
        "deniedPatterns": ["absolute home paths, secret files, and unbounded traversal"]
      },
      "constraints": [
        "Remain inside the declared repository scope.",
        "Bound traversal depth and output.",
        "Exclude secret-bearing and generated directories."
      ]
    },
    {
      "name": "git-identity-inspection",
      "executables": ["git"],
      "argumentPolicy": {
        "strategy": "exact",
        "allowedPatterns": ["rev-parse, remote -v, and status --short --branch"],
        "deniedPatterns": ["all Git mutation and publication subcommands"]
      },
      "constraints": [
        "Allow only rev-parse, remote -v, and status --short --branch."
      ]
    }
  ],
  "restrictedCategories": [
    "file-write",
    "package-install",
    "deployment",
    "git-mutation",
    "unrestricted-scan",
    "secret-read",
    "process-mutation",
    "service-mutation",
    "migration-apply",
    "privileged-api"
  ],
  "approvalExceptions": [
    "A named-file approval may permit one otherwise excluded non-mutating read."
  ]
}
